{
  "version": 1,
  "workflow_name": "example feature rollout",
  "workflow_status": "active",
  "escalation": null,
  "mode": "ship",
  "plan_path": "PLANS.md",
  "review_path": "code_review.md",
  "ship_skill": "ship",
  "current_step_id": "step-1",
  "base_branch": "origin/main",
  "request_codex_review": true,
  "ship_record": null,
  "uat_artifact_path": ".codex/workflow/uat.json",
  "metrics_dir": ".codex/workflow/metrics",
  "steps": [
    {
      "id": "step-1",
      "title": "Implement the first commit-worthy slice",
      "goal": "Land the first execution step and verify it before review.",
      "context": [
        "app/example/module.py",
        "tests/example/test_module.py"
      ],
      "constraints": [
        "Keep the diff scoped to this execution step.",
        "Update AGENTS guidance only if the durable rules changed."
      ],
      "done_when": [
        "The requested behavior for step 1 works.",
        "Step-specific verification passes."
      ],
      "verify_cmds": [
        "uv run pytest tests/example/test_module.py"
      ],
      "agents_paths": [
        "AGENTS.md",
        "app/example/AGENTS.md"
      ],
      "commit_message": "feature: land example step 1",
      "justification": "This isolates the first behavior change so review and rollback remain simple.",
      "files_read_first": [
        "app/example/module.py",
        "tests/example/test_module.py"
      ],
      "interfaces_to_preserve": [
        "Example module public behavior contract"
      ],
      "avoid_touching": [
        "app/example/second_module.py"
      ],
      "verification_targets": [
        "tests/example/test_module.py"
      ],
      "risk_flags": [
        "Consumer behavior must remain stable for current callers."
      ],
      "blast_radius": [
        "app/example/module.py consumers",
        "tests/example/test_module.py"
      ],
      "decision_ids": [
        "D-EXAMPLE-STEP-1"
      ],
      "depends_on": [],
      "wave": 1,
      "file_ownership": [
        "app/example/module.py",
        "tests/example/test_module.py"
      ],
      "rollback_notes": [
        "Revert the step 1 commit if the first verified slice regresses current callers."
      ],
      "operational_watchpoints": [
        "Watch the example module public behavior contract during review and verification."
      ],
      "agents_update_required": false,
      "status": "implementing",
      "review_summary": null,
      "review_record": null
    },
    {
      "id": "step-2",
      "title": "Land the second commit-worthy slice",
      "goal": "Complete the next execution step only after step 1 is committed.",
      "context": [
        "app/example/second_module.py"
      ],
      "constraints": [
        "Assume step 1 is already committed before this work starts."
      ],
      "done_when": [
        "The requested behavior for step 2 works."
      ],
      "verify_cmds": [
        "uv run pytest tests/example/test_second_module.py"
      ],
      "agents_paths": [
        "AGENTS.md"
      ],
      "commit_message": "feature: land example step 2",
      "justification": "This lands the second behavior change without reopening the first slice.",
      "files_read_first": [
        "app/example/second_module.py",
        "tests/example/test_second_module.py"
      ],
      "interfaces_to_preserve": [
        "Second example module public behavior contract"
      ],
      "avoid_touching": [
        "app/example/module.py"
      ],
      "verification_targets": [
        "tests/example/test_second_module.py"
      ],
      "risk_flags": [
        "Step 1 behavior must remain intact after the follow-up slice."
      ],
      "blast_radius": [
        "app/example/second_module.py consumers"
      ],
      "decision_ids": [
        "D-EXAMPLE-STEP-2"
      ],
      "depends_on": [
        "step-1"
      ],
      "wave": 2,
      "file_ownership": [
        "app/example/second_module.py",
        "tests/example/test_second_module.py"
      ],
      "rollback_notes": [
        "Revert only the step 2 commit if the follow-up slice destabilizes the first slice."
      ],
      "operational_watchpoints": [
        "Watch downstream consumers of the second example module while step 2 lands."
      ],
      "agents_update_required": false,
      "status": "pending",
      "review_summary": null,
      "review_record": null
    }
  ]
}
